<?xml version="1.0" encoding="UTF-8"?>
<xs:schema xmlns:xs="http://www.w3.org/2001/XMLSchema"
	targetNamespace="http://www.w3schools.com"
	xmlns="http://www.w3schools.com"
	elementFormDefault="qualified">
	<xs:element name="users">
		<xs:complexType>
			<xs:sequence>
				<xs:element name="user" type="usertype" maxOccurs="unbounded"/>
			</xs:sequence>
		</xs:complexType>
	</xs:element>
	
	<xs:complexType name="usertype">
		<xs:sequence>
			<xs:element name="id" type="xs:long"/>
			<xs:element name="firstname" type="xs:string"/>
			<xs:element name="lastname" type="xs:string"/>
			<xs:element name="email" type="xs:string"/>
			<xs:element name="roleid" type="xs:long"/>
			<xs:element name="password" type="xs:string"/>
		</xs:sequence>
	</xs:complexType>
</xs:schema>